{
  "$schema": "http://json-schema.org/draft-07/schema#",
  "$id": "https://optimafilings.com/schema/rule.v1.json",
  "title": "Optima Filings rule, v1",
  "description": "One filing obligation in one jurisdiction. See docs/rule-authoring.md \u2014 you can usually copy a neighbouring rule and change three fields.",
  "definitions": {
    "condition": {
      "type": "object",
      "additionalProperties": false,
      "required": [
        "fact",
        "op",
        "value"
      ],
      "properties": {
        "fact": {
          "enum": [
            "grossRevenueMinorUnits",
            "totalAssetsMinorUnits",
            "charitableAssetsMinorUnits",
            "employeeCount",
            "solicitsCharitableContributions",
            "isPrivateFoundation",
            "isSupportingOrganization",
            "contributionsRaisedMinorUnits",
            "allFundraisingUnpaid",
            "assetsOrIncomeInureToInsiders",
            "incomeProducingCharitableAssetsMinorUnits",
            "normalAnnualGrossReceiptsMinorUnits"
          ],
          "description": "Most of these are facts an entity supplies. normalAnnualGrossReceiptsMinorUnits is DERIVED by the engine from gross revenue and the two prior years, per Rev. Proc. 2011-15 section 4 - a federal 'normally not more than' test is an average, not a single year's figure, so a rule that means the IRS test must name the derived fact and not the raw one. Several pairs here are deliberately NEAR-SYNONYMS that a rule author must not swap: grossRevenueMinorUnits is all revenue while contributionsRaisedMinorUnits is only what was raised by asking, and charitableAssetsMinorUnits is everything held for charitable purposes while incomeProducingCharitableAssetsMinorUnits is only the part invested for income. Picking the wider one where a statute names the narrower one over-triggers a registration, which is the mistake WAC 434-120-305 was read to correct."
        },
        "op": {
          "enum": [
            "lt",
            "lte",
            "gt",
            "gte",
            "eq"
          ]
        },
        "value": {
          "type": [
            "integer",
            "boolean"
          ]
        }
      }
    }
  },
  "type": "object",
  "additionalProperties": false,
  "required": [
    "id",
    "jurisdiction",
    "title",
    "agency",
    "entityTypes",
    "cadence",
    "citation",
    "lastVerified",
    "status",
    "effectiveFrom"
  ],
  "properties": {
    "$schema": {
      "type": "string",
      "description": "Relative path to this schema. Gives editors autocomplete and inline validation."
    },
    "id": {
      "type": "string",
      "pattern": "^[a-z0-9]+(-[a-z0-9]+)*$",
      "description": "Stable, kebab-case, jurisdiction-prefixed: us-wa-sos-annual-report. A PERMANENT PUBLIC IDENTIFIER \u2014 the B2B API and customer integrations key off it. Never rename one; supersede it instead."
    },
    "jurisdiction": {
      "type": "string",
      "pattern": "^(US|US-[A-Z]{2}(/[a-z0-9-]+)?)$",
      "description": "US for federal, ISO 3166-2 for states (US-WA), US-WA/seattle for a municipality."
    },
    "title": {
      "type": "string",
      "minLength": 3,
      "description": "What the filer sees. 'Annual Report', not the rule id."
    },
    "agency": {
      "type": "string",
      "minLength": 3,
      "description": "The body it is filed with, spelled out: 'Washington Secretary of State'."
    },
    "entityTypes": {
      "type": "array",
      "minItems": 1,
      "uniqueItems": true,
      "items": {
        "enum": [
          "501c3",
          "nonprofit-corp",
          "llc",
          "s-corp",
          "c-corp",
          "b-corp"
        ]
      },
      "description": "Every legal form this rule applies to. A rule applies if the entity holds ANY of them."
    },
    "cadence": {
      "description": "How often it recurs and what the due date is anchored to.",
      "oneOf": [
        {
          "type": "object",
          "additionalProperties": false,
          "required": [
            "type",
            "anchor",
            "dayOfMonth"
          ],
          "properties": {
            "type": {
              "enum": [
                "annual",
                "biennial"
              ]
            },
            "anchor": {
              "const": "formation-month"
            },
            "dayOfMonth": {
              "oneOf": [
                {
                  "type": "integer",
                  "minimum": 1,
                  "maximum": 31
                },
                {
                  "const": "last"
                }
              ],
              "description": "A day past the end of the month clamps to the last day; it does not roll into the next one."
            }
          }
        },
        {
          "type": "object",
          "additionalProperties": false,
          "required": [
            "type",
            "anchor"
          ],
          "description": "Due on the anniversary of formation \u2014 month AND day come from the ENTITY, so every entity has a different due date. Oregon (ORS 65.787(1), 60.787(1), 63.787(1): \"by the corporation's anniversary\"). There is deliberately no dayOfMonth: that is the whole distinction from formation-month, where the RULE names the day. The two agree only when an entity was formed on a month end, which is why picking the wrong one is a silent up-to-30-day error.",
          "properties": {
            "type": {
              "enum": [
                "annual",
                "biennial"
              ]
            },
            "anchor": {
              "const": "formation-anniversary"
            }
          }
        },
        {
          "type": "object",
          "additionalProperties": false,
          "required": [
            "type",
            "anchor",
            "month",
            "day"
          ],
          "properties": {
            "type": {
              "enum": [
                "annual",
                "biennial"
              ]
            },
            "anchor": {
              "const": "calendar"
            },
            "month": {
              "type": "integer",
              "minimum": 1,
              "maximum": 12
            },
            "day": {
              "type": "integer",
              "minimum": 1,
              "maximum": 31
            }
          }
        },
        {
          "type": "object",
          "additionalProperties": false,
          "required": [
            "type",
            "anchor",
            "offsetMonths",
            "dayOfMonth"
          ],
          "properties": {
            "type": {
              "const": "annual"
            },
            "anchor": {
              "const": "fiscal-year-end"
            },
            "offsetMonths": {
              "type": "integer",
              "minimum": 0,
              "maximum": 24
            },
            "dayOfMonth": {
              "oneOf": [
                {
                  "type": "integer",
                  "minimum": 1,
                  "maximum": 31
                },
                {
                  "const": "last"
                }
              ]
            }
          }
        },
        {
          "type": "object",
          "additionalProperties": false,
          "required": [
            "type",
            "anchor",
            "offsetDays"
          ],
          "properties": {
            "type": {
              "const": "one-time"
            },
            "anchor": {
              "const": "formation"
            },
            "offsetDays": {
              "type": "integer",
              "minimum": 0
            }
          }
        }
      ]
    },
  "fee": {
      "description": "What the filing costs. TWO SHAPES, and choosing between them is a claim about how well the cost is known. EXACT is one number every filer pays. INEXACT is a range with a required explanation, for a cost computed per filer or turning on something outside the fact model \u2014 Delaware's franchise tax is computed per corporation between $175 and $200,000, and no single number is honest. A rule may also carry NO fee, which says the cost was never established. NEVER invent a flat number to fill this field: showing $50 for a filing that costs $175 to $200,000 sends someone to the wrong budget, and that was this field's first real defect (NEH-403).",
      "oneOf": [
        {
          "title": "Exact fee",
          "description": "One number the agency charges every filer of this form. Use this whenever it is true.",
          "type": "object",
          "additionalProperties": false,
          "required": [
            "amountMinorUnits",
            "currency"
          ],
          "properties": {
            "amountMinorUnits": {
              "type": "integer",
              "minimum": 0,
              "description": "INTEGER MINOR UNITS. 6000 is $60.00. Never a float \u2014 a rounding error in a fee is a support ticket and a credibility hit."
            },
            "currency": {
              "const": "USD"
            }
          }
        },
        {
          "title": "Inexact fee",
          "description": "A cost that is not one number, stated as bounds plus a required explanation. At least one bound must be given; both is better. An open-ended range is honest \u2014 'at least $175' with no maximum says more than silence does.",
          "type": "object",
          "additionalProperties": false,
          "required": [
            "basis",
            "currency",
            "explanation"
          ],
          "anyOf": [
            {
              "required": [
                "minimumMinorUnits"
              ]
            },
            {
              "required": [
                "maximumMinorUnits"
              ]
            }
          ],
          "properties": {
            "basis": {
              "enum": [
                "computed",
                "conditional"
              ],
              "description": "WHY the cost is not one number, because the two want different things of a reader. 'computed' means the agency calculates it from the filer's own figures and only they can arrive at it \u2014 Delaware's franchise tax. 'conditional' means it is one of a few fixed amounts and which one depends on something the entity does or declares \u2014 Washington's annual report is $20 or $60 depending on a certification the corporation makes. A reader can act on 'conditional' by finding out which case they are in; 'computed' sends them to the agency's calculator."
            },
            "minimumMinorUnits": {
              "type": "integer",
              "minimum": 0,
              "description": "INTEGER MINOR UNITS. The least any filer of this form pays. Omit only if genuinely unbounded below."
            },
            "maximumMinorUnits": {
              "type": "integer",
              "minimum": 0,
              "description": "INTEGER MINOR UNITS. The most any filer pays. Omit when the statute sets no ceiling \u2014 an absent maximum is a fact about the law, not a gap in the record."
            },
            "explanation": {
              "type": "string",
              "minLength": 1,
              "description": "One or two sentences a filer can act on, shown to them verbatim. REQUIRED, and that is the point of this shape: a range with no reason is barely better than the wrong flat number it replaces. Say what varies and where they can settle it \u2014 'the franchise tax is computed from authorised shares or assumed par value; Delaware's calculator gives your figure'. Write it for the filer, not for a maintainer: no issue ids, no branch names, nothing that only makes sense with repository access."
            },
            "currency": {
              "const": "USD"
            }
          }
        }
      ]
    },
    "conditions": {
      "type": "array",
      "minItems": 1,
      "description": "The rule applies only when ALL entries hold. An entry is either a single test, or an {\"anyOf\": [...]} group that holds when ANY of its members does \u2014 for a threshold the statute writes as 'X or Y', such as Form 990's receipts-or-assets test. A condition may only test a fact the entity fact model defines; rules:validate enforces that.",
      "items": {
        "oneOf": [
          {
            "$ref": "#/definitions/condition"
          },
          {
            "type": "object",
            "additionalProperties": false,
            "required": [
              "anyOf"
            ],
            "properties": {
              "anyOf": {
                "type": "array",
                "minItems": 2,
                "description": "Holds when any member holds. One level deep only \u2014 a group may not contain another group. Nesting would make rules markedly harder for a non-developer to author and for a reviewer to check against a statute, which is the point of the format.",
                "items": {
                  "$ref": "#/definitions/condition"
                }
              }
            }
          }
        ]
      }
    },
    "form": {
      "type": "string",
      "description": "Form number or name, where the agency uses one."
    },
    "citation": {
      "type": "string",
      "minLength": 4,
      "description": "REQUIRED. The statute, regulation, or agency page this came from \u2014 'RCW 24.03A.075'. A rule without a citation is unreviewable. Cite the primary source, never another compliance vendor: they are wrong often enough that copying them imports their errors."
    },
    "citationUrl": {
      "type": "string",
      "format": "uri",
      "description": "Direct link to the statute or agency page, where one exists."
    },
    "agencyUrl": {
      "type": "string",
      "format": "uri",
      "description": "The agency's OWN page for this filing \u2014 where a filer goes to file it and to read the current fee, form and deadline. Distinct from citationUrl, which is the legal source a reviewer checks the rule against. Both are needed because the statute frequently does not carry the operative detail: RCW 23.95.255(4) hands the due date to the secretary of state, and 8 Del. C. 502 sets no fee at all. Required in practice for every shipped rule; optional in the schema only because a filing with no agency page on the public web is conceivable."
    },
    "lastVerified": {
      "type": "string",
      "format": "date",
      "description": "The date a human last read the primary source and confirmed this rule. Bumping it without re-reading is worse than leaving it stale \u2014 it converts an honest 'unknown' into a false 'checked'."
    },
    "status": {
      "enum": [
        "draft",
        "active"
      ],
      "description": "'draft' means written but NOT yet checked against the primary source by a human. It is the honest state for a rule you are unsure about, not a lesser form of 'active' \u2014 contribute a draft rather than asserting something you have not verified. Promotion to 'active' means someone read the statute."
    },
    "effectiveFrom": {
      "type": "string",
      "format": "date",
      "description": "First date this version of the rule governs."
    },
    "effectiveTo": {
      "type": "string",
      "format": "date",
      "description": "Last date it governs. Absent means still in force. When a fee or deadline changes, set this and add a NEW rule \u2014 never edit in place, or the historical answer is destroyed and the change escapes review."
    },
    "supersededBy": {
      "type": "string",
      "description": "Id of the rule that replaced this one."
    },
    "weekendRule": {
      "enum": [
        "roll-forward",
        "roll-backward"
      ],
      "description": "Opt in only where the statute or agency actually says a weekend deadline moves, and pick the direction the statute states. Rolling by default, or guessing the direction, would invent a legal position the rule never claimed. roll-forward: the IRS moves a weekend due date to the next business day. roll-backward: an agency asking for the last business day OF A PERIOD, such as WAC 434-120-140(2)(a), moves it earlier."
    },
    "notes": {
      "type": "string",
      "description": "Anything a reviewer needs \u2014 a quirk, an ambiguity, what was checked."
    },
    "holidayCalendar": {
      "type": "string",
      "enum": [
        "us-federal"
      ],
      "description": "Holiday calendar this agency observes. Opt-in, like weekendRule, and only meaningful alongside it. State holidays are not modelled, so a state rule names nothing and its obligations report no calendar - which is how a consumer can tell an unchecked date from a checked one."
    }
  }
}
