{
  "$schema": "../../schema/rule.v1.json",
  "id": "us-or-sos-llc-annual-report",
  "jurisdiction": "US-OR",
  "title": "Limited Liability Company Annual Report",
  "agency": "Oregon Secretary of State, Corporation Division",
  "entityTypes": [
    "llc"
  ],
  "cadence": {
    "type": "annual",
    "anchor": "formation-anniversary"
  },
  "fee": {
    "amountMinorUnits": 10000,
    "currency": "USD"
  },
  "citation": "ORS 63.787",
  "citationUrl": "https://www.oregonlegislature.gov/bills_laws/ors/ors063.html",
  "agencyUrl": "https://sos.oregon.gov/business/Pages/obr-annual-report-renewal.aspx",
  "lastVerified": "2026-08-01",
  "status": "active",
  "effectiveFrom": "2020-01-01",
  "notes": "DEADLINE FIXED 2026-08-05 (NEH-400). This rule used anchor \"formation-month\" with dayOfMonth \"last\" \u2014 the end of the anniversary month \u2014 and was therefore up to 30 days LATE, the direction that costs a customer a penalty. ORS 63.787(1) VERBATIM: the report is due \"by the limited liability company's anniversary\", which is the anniversary DATE. Oregon's SOS says the same: \"Your renewal is due on the anniversary date of the original filing.\" Now anchor \"formation-anniversary\", which takes the month and day from the entity. Leap days need no special case: 29 February clamps to the 28th in a common year, which is what ORS 65.001 defines the anniversary to be. FEE VERIFIED 2026-08-05: $100 \u2014 read directly from the SOS Business Registry Fee Schedule PDF, \"LIMITED LIABILITY COMPANIES > Domestic > Renewal (Annually) $100.00\". STILL DRAFT: the deadline and fee are now checked, but promotion to active means a PERSON has read the statute. See docs/rule-verification/. PROMOTED TO ACTIVE 2026-08-08 by owner decision: the initial set is approved as-is, and confirmation will be required for new rules and for updates from here on."
}
