{
  "$schema": "../../schema/rule.v1.json",
  "id": "us-de-llc-annual-tax",
  "jurisdiction": "US-DE",
  "title": "Limited Liability Company Annual Tax",
  "agency": "Delaware Division of Corporations",
  "entityTypes": [
    "llc"
  ],
  "cadence": {
    "type": "annual",
    "anchor": "calendar",
    "month": 6,
    "day": 1
  },
  "fee": {
    "amountMinorUnits": 40000,
    "currency": "USD"
  },
  "citation": "6 Del. C. 18-1107",
  "citationUrl": "https://delcode.delaware.gov/title6/c018/sc11/index.html",
  "agencyUrl": "https://corp.delaware.gov/paytaxes/",
  "lastVerified": "2026-08-01",
  "status": "active",
  "effectiveFrom": "2020-01-01",
  "notes": "AMOUNT CORRECTED 2026-08-05: was $300, now $400. The previous note asked for exactly this check and it was right to. 6 Del. C. 18-1107(b), VERBATIM: \"Every domestic limited liability company and every foreign limited liability company registered to do business in the State of Delaware shall pay an annual tax, for the use of the State of Delaware, in the amount of $400.\" Read twice from delcode.delaware.gov to be sure. DUE DATE VERIFIED: \"The annual tax for a domestic limited liability company shall be due and payable on the first day of June following the close of the calendar year\" \u2014 a fixed calendar date, which is what this rule already encodes. NO ANNUAL REPORT VERIFIED: 18-1107 requires the tax only; Delaware LLCs file no annual report. Unpaid tax accrues interest at 1.5% per month, which the schema has no way to express. PROMOTED TO ACTIVE 2026-08-08 by owner decision: the initial set is approved as-is, and confirmation will be required for new rules and for updates from here on."
}
