{
  "$schema": "../../schema/rule.v1.json",
  "id": "us-wa-sos-llc-annual-report",
  "jurisdiction": "US-WA",
  "title": "Limited Liability Company Annual Report",
  "agency": "Washington Secretary of State",
  "entityTypes": [
    "llc"
  ],
  "cadence": {
    "type": "annual",
    "anchor": "formation-month",
    "dayOfMonth": "last"
  },
  "citation": "RCW 25.15.106; RCW 23.95.255",
  "citationUrl": "https://app.leg.wa.gov/rcw/default.aspx?cite=25.15",
  "agencyUrl": "https://www.sos.wa.gov/corporations-charities/business-entities/maintain-business-compliance/annual-reports",
  "lastVerified": "2026-08-01",
  "status": "active",
  "effectiveFrom": "2020-01-01",
  "notes": "VERIFIED 2026-08-05 (requirement only): RCW 25.15.106 reads \"Each domestic limited liability company, and each foreign limited liability company authorized to transact business in this state, must deliver to the secretary of state for filing initial and annual reports in accordance with RCW 23.95.255.\" Both sections read; the section number in this rule was correct. DUE DATE NOT SETTLEABLE FROM STATUTE: RCW 23.95.255(4) says annual reports are due \"on a date determined by the secretary of state\", so no statute fixes it. The end-of-formation-month cadence here rests on the SOS's published practice, which needs a human to confirm. FEE UNVERIFIED and PROBABLY WRONG: search results attributed to sos.wa.gov give $70 for profit business entity types including LLCs, not the $60 recorded here. sos.wa.gov returns 403 to automated retrieval, so this could not be read from the agency page directly and the value is left unchanged rather than swapped for a second unverified number. A person must open the SOS fee schedule. AGENCY URL NOT CLICKABLE FROM CI: sos.wa.gov returns 403 to every automated request \u2014 including its own root and a path that does not exist, so the status carries no information about whether a URL is real. This one is the agency's own published page (search engines have crawled it) but nobody here has opened it. A person must, once. See NEH-402. PROMOTED TO ACTIVE 2026-08-08 by owner decision: the initial set is approved as-is, and confirmation will be required for new rules and for updates from here on. FEE REMOVED on promotion: same as the corporation report \u2014 $60 recorded, sos.wa.gov indicates $70, already flagged 'UNVERIFIED and PROBABLY WRONG' above."
}
