{
  "id": "us-wa-example-fixture-draft-undecidable",
  "jurisdiction": "US-WA",
  "title": "Example Fixture Draft Headcount Filing",
  "agency": "Example Fixture Agency",
  "entityTypes": ["nonprofit-corp"],
  "cadence": { "type": "annual", "anchor": "calendar", "month": 9, "day": 1 },
  "conditions": [{ "fact": "employeeCount", "op": "gte", "value": 1 }],
  "citation": "Example Fixture Code 1.02.040",
  "lastVerified": "2026-01-01",
  "status": "draft",
  "effectiveFrom": "2020-01-01",
  "notes": "A FAKE rule, and deliberately undecidable: employeeCount has no field on the entity form, so this always lands in 'Cannot tell yet' and gives the badge rendered there something to assert."
}
