{
  "$schema": "../../schema/rule.v1.json",
  "id": "us-wa-sos-nonprofit-annual-report",
  "jurisdiction": "US-WA",
  "title": "Nonprofit Corporation Annual Report",
  "agency": "Washington Secretary of State",
  "entityTypes": [
    "501c3",
    "nonprofit-corp"
  ],
  "cadence": {
    "type": "annual",
    "anchor": "formation-month",
    "dayOfMonth": "last"
  },
  "fee": {
    "basis": "conditional",
    "minimumMinorUnits": 2000,
    "maximumMinorUnits": 6000,
    "explanation": "Either $20 or $60, and which one is up to you. The annual report itself is $10 (WAC 434-112-085(8)(m)), plus a Charitable Asset Protection Account fee of $50 — reduced to $10 if the corporation certifies that its total gross revenue in the most recent fiscal year was under $500,000 (RCW 24.03A.960(2)(b)). The reduction turns on making that certification, not on the revenue alone, so a corporation that qualifies and does not certify pays $60.",
    "currency": "USD"
  },
  "citation": "RCW 24.03A.070; RCW 23.95.255(2); WAC 434-112-060(1); WAC 434-112-085(8)(m); RCW 24.03A.960(2)(b)",
  "citationUrl": "https://app.leg.wa.gov/rcw/default.aspx?cite=24.03A",
  "agencyUrl": "https://www.sos.wa.gov/corporations-charities/business-entities/maintain-business-compliance/annual-reports",
  "lastVerified": "2026-08-08",
  "status": "active",
  "effectiveFrom": "2022-01-01",
  "notes": "VERIFIED 2026-08-08 — requirement and due date settled; the fee is understood but still cannot be expressed. REQUIREMENT: RCW 24.03A.070 — \"Each domestic nonprofit corporation, and each registered foreign nonprofit corporation, shall deliver to the secretary of state for filing an annual report as required under RCW 23.95.255(2)\". (An earlier version of this rule cited RCW 24.03A.1010, which does not exist; that was corrected 2026-08-05.) DUE DATE NOW CITED: WAC 434-112-060(1) — an entity defined by RCW 23.95.105(6) and subject to RCW 23.95.255 \"must file an annual report accompanied by the fee established under WAC 434-112-085 by the last day of the month that the entity was formed or registered by the division\". This REPLACES the earlier note that the date was not settleable: RCW 23.95.255(4) delegates the date to the secretary of state, and WAC 434-112-060(1) is where the secretary set it, so the end-of-formation-month cadence is a regulation rather than unwritten practice. WAC 434-112-060(2) also confirms the 180-day early-filing window the agency advertises. A nonprofit corporation is an \"entity\" under RCW 23.95.105(6)(b), so this WAC reaches it. FEE STILL ABSENT, and the shape is now known precisely — it is NOT the flat \"$60 reduced to $20\" previously assumed. WAC 434-112-085(8)(m) sets the annual report at \"Ten dollars, plus the Charitable Asset Protection Account fee\", and RCW 24.03A.960(2)(b) sets that fee at \"fifty dollars per year, reduced to ten dollars if the corporation certifies that its total gross revenue in the most recent fiscal year was less than five hundred thousand dollars\". So $10 + $50 = $60, or $10 + $10 = $20 — matching the \"$20-60\" the SOS fee schedule shows. Two things this changes for the schema work in NEH-403: it is a base fee plus a conditional surcharge rather than one conditional amount, and the reduction turns on the corporation CERTIFYING its revenue, not on the revenue fact alone. A flat figure would still be wrong for one group or the other, and the group $60 overstates threefold is the larger one, so no fee is recorded. sos.wa.gov IS reachable by an ordinary browser; the earlier \"403 to every automated request\" note was a property of the fetcher used, not of the site, and a wrong path returns a plain 404 — so response status does carry information after all. The agency page linked here was opened and read. See NEH-402 and NEH-403. FEE RECORDED 2026-09-09 AS AN INEXACT FEE (NEH-403). The note above says the shape is \"a base fee plus a conditional surcharge rather than one conditional amount, and the reduction turns on the corporation CERTIFYING its revenue, not on the revenue fact alone\" — which is exactly why the conditional-fee list considered under NEH-403 was rejected. Keying the surcharge on grossRevenueMinorUnits would confidently show $20 to a corporation that qualifies but does not certify, and be wrong. The range $20-$60 with the reason stated is the honest form, and it matches the \"$20-60\" the SOS fee schedule publishes. Figures unchanged from the 2026-08-08 verification recorded above and in docs/rule-verification/2026-08-08-wa-annual-reports.md; no new primary-source reading was done for them on this date, and lastVerified is deliberately NOT bumped."
}
