{
  "$schema": "../../schema/rule.v1.json",
  "id": "us-de-nonprofit-annual-report",
  "jurisdiction": "US-DE",
  "title": "Nonprofit (Exempt) Corporation Annual Report",
  "agency": "Delaware Division of Corporations",
  "entityTypes": [
    "501c3",
    "nonprofit-corp"
  ],
  "cadence": {
    "type": "annual",
    "anchor": "calendar",
    "month": 3,
    "day": 1
  },
  "fee": {
    "amountMinorUnits": 2500,
    "currency": "USD"
  },
  "citation": "8 Del. C. 502(a); 8 Del. C. 501(a), (b); 8 Del. C. 391(a)(18), (j); 8 Del. C. 114(a), (d)(1)",
  "citationUrl": "https://delcode.delaware.gov/title8/c005/index.html",
  "agencyUrl": "https://corp.delaware.gov/paytaxes/",
  "lastVerified": "2026-09-09",
  "status": "draft",
  "effectiveFrom": "2020-01-01",
  "notes": "NEW 2026-09-09 (NEH-194). Delaware had a corporation rule and an LLC rule and no nonprofit rule, while WA and OR both had one. DELAWARE HAS NO SEPARATE NONPROFIT ACT: a Delaware nonprofit incorporates under Chapter 1 of Title 8 as a nonstock corporation, which is why the ordinary corporation sections reach it. 8 Del. C. 114(a) VERBATIM: \"Except as otherwise provided in subsections (b) and (c) of this section, the provisions of this chapter and of chapter 5 of this title shall apply to nonstock corporations...\". 8 Del. C. 114(d)(1) VERBATIM: \"A 'charitable nonstock corporation' is any nonprofit nonstock corporation that is exempt from taxation under § 501(c)(3) of the United States Internal Revenue Code\". Neither 114(b) nor 114(c) carves out § 501 or § 502; the only Chapter 5 section named in 114(b)(1) is § 503, and it is named as applying to nonstock corporations BY ITS TERMS, not as excluded. REQUIREMENT AND DUE DATE, 8 Del. C. 502(a) VERBATIM: \"Annually on or before March 1, every corporation now existing or hereafter incorporated under Chapter 1 of this title or which has accepted the Constitution of this State, shall make an annual franchise tax report to the Secretary of State.\" That sentence is unqualified — it reaches exempt corporations too, and being exempt from the TAX does not excuse the REPORT. The March 1 fixed calendar date is the same one the sibling us-de-corporation-annual-report encodes. NO FRANCHISE TAX, which is the whole reason this is a separate rule rather than an entityTypes addition to the corporation rule. 8 Del. C. 501(a) VERBATIM: \"No such tax shall be paid by any exempt corporation, any banking corporation, savings bank, building and loan association or any captive insurance company licensed under Chapter 69 of Title 18, or any corporation for drainage and reclamation of lowlands.\" 8 Del. C. 501(b) defines the term VERBATIM: \"As used in this chapter, the term 'exempt corporation' shall be defined as any corporation organized under Chapter 1 of this title that: (1) Is exempt from taxation under § 501(c) of the United States Internal Revenue Code (26 U.S.C. § 501(c)) or any similar provisions of the Internal Revenue Code, or any successor provisions; ... (5) Is organized primarily or exclusively for religious or charitable purposes...; or (6) a. Is organized not for profit; and b. No part of its net earnings inures to the benefit of any member or individual.\" A 501(c)(3) qualifies under 501(b)(1); a nonprofit corporation that is not federally exempt still qualifies under 501(b)(6). Both of this rule's entityTypes are therefore inside the definition. FEE IS RECORDED HERE, AND THAT IS THE DELIBERATE DIFFERENCE FROM THE SIBLING CORPORATION RULE, which carries no fee because its real cost is a computed franchise tax the schema cannot express (8 Del. C. 503: \"more than $200,000 nor less than $175\" / \"nor less than $400\"). An exempt corporation owes NO franchise tax, so the report fee is the entire cost and it is flat and statutory. 8 Del. C. 391(a)(18) VERBATIM: \"For receiving and filing and/or indexing an annual franchise tax report of a corporation provided for by § 502 of this title, a fee of $25 shall be paid by exempt corporations and a fee of $50 shall be paid by all other corporations.\" 8 Del. C. 391(j) VERBATIM: \"As used in this section, the term 'exempt corporation' shall have the meaning given to it in § 501(b) of this title.\" The agency's own page agrees: corp.delaware.gov/paytaxes/ lists \"Exempt Domestic Corporations - $25.00\" against \"Non-Exempt Domestic Corporations - $50.00\", and \"All active Domestic Corporation Annual Reports and Franchise Taxes for the prior year are due annually on or before March 1st\". WHAT effectiveFrom DOES AND DOES NOT CLAIM. 2020-01-01 matches the two sibling Delaware rules and is a conservative floor for the REPORTING OBLIGATION, which § 502 has imposed in substantially this form since 1899 (21 Del. Laws, c. 166). It is NOT a sourced claim about when the $25 figure took effect: § 391's session-law history runs to 85 Del. Laws, c. 273, that session law was not read, and the archived year-by-year code editions that would settle it are on secondary sites (law.justia.com returned HTTP 403 and was not used regardless, per the no-vendor-sources rule). The $25 is verified as the CURRENT text of § 391(a)(18) read from delcode.delaware.gov on 2026-09-09, corroborated by the agency's own fee page the same day. If a historical answer for a prior year is ever needed, read the session law first. LATE PENALTY NOT MODELLED: 8 Del. C. 502(c) adds \"$200 to be recovered by adding that amount to the franchise tax\" for a late or incomplete report. The schema has no penalty field, and the sibling corporation rule records the same fact the same way. NO WEEKEND RULE: § 502 says nothing about a March 1 that falls on a weekend, and neither does the agency page, so none is asserted — inventing a direction would be a legal position this rule never checked. STATUS IS DRAFT. Promotion to active is an owner decision, per the \"PROMOTED TO ACTIVE 2026-08-08 by owner decision\" note on the sibling rules. See docs/rule-verification/2026-09-09-delaware-nonprofit-and-boi.md for every URL opened."
}
