{
  "$schema": "../../schema/rule.v1.json",
  "id": "us-wa-charitable-trust-registration",
  "jurisdiction": "US-WA",
  "title": "Charitable Trust Registration Renewal",
  "agency": "Washington Secretary of State, Charities Program",
  "entityTypes": [
    "501c3",
    "nonprofit-corp"
  ],
  "cadence": {
    "type": "annual",
    "anchor": "fiscal-year-end",
    "offsetMonths": 11,
    "dayOfMonth": "last"
  },
  "fee": {
    "amountMinorUnits": 2500,
    "currency": "USD"
  },
  "conditions": [
    {
      "fact": "incomeProducingCharitableAssetsMinorUnits",
      "op": "gt",
      "value": 25000000
    }
  ],
  "citation": "RCW 11.110.051; WAC 434-120-305; WAC 434-120-025; WAC 434-120-042",
  "citationUrl": "https://app.leg.wa.gov/wac/default.aspx?cite=434-120-305",
  "agencyUrl": "https://www.sos.wa.gov/corporations-charities/charities",
  "lastVerified": "2026-09-09",
  "status": "active",
  "effectiveFrom": "2020-01-01",
  "notes": "SPLIT OUT OF us-wa-charitable-solicitation-registration on 2026-08-05 (NEH-401). That rule triggered on soliciting OR holding $250,000+ in charitable assets, but those are TWO DIFFERENT REGISTRATIONS under two different chapters, with their own forms, fees and deadlines. An endowed non-soliciting charity was being told to file the solicitation renewal \u2014 wrong form at nearly twice the price. THRESHOLD VERIFIED, WAC 434-120-305 VERBATIM: a trustee must register if 'the trustee holds assets, invested for income-producing purposes, exceeding a value of two hundred fifty thousand dollars'. Note 'EXCEEDING' \u2014 hence gt, not gte. A trust holding exactly $250,000 does not register, and the previous gte was off by one at precisely the boundary. \u201cINVESTED FOR INCOME-PRODUCING PURPOSES\u201d IS NOW TESTED DIRECTLY, 2026-09-09. This sentence used to read that charitableAssetsMinorUnits \u201cis the closest fact the model has and is not exactly that\u201d, and that an entity holding $250k of non-income-producing charitable property might be caught when the statute would not catch it. That over-trigger was real and is removed: the condition now tests incomeProducingCharitableAssetsMinorUnits, a NEW fact meaning the portion of charitable assets invested for income-producing purposes, which is the quantity WAC 434-120-305 names. The qualifier does real work \u2014 a land trust holding conservation easements, a museum holding a collection and a food bank holding its warehouse each hold charitable assets far over $250,000 and none of them holds assets invested for income. All three were being told to register and pay. A NEW FACT RATHER THAN A REDEFINITION OF THE OLD ONE: charitableAssetsMinorUnits keeps its meaning and stays in the model because it is what several other states test and what self-hosters have already answered; narrowing it in place would have silently re-answered a question on their behalf, which packages/engine/src/facts.ts calls out as the one change that is not cheap. CONSEQUENCE FOR EXISTING USERS, STATED PLAINLY: an organisation that answered only the broader figure now gets an UNDECIDED trust registration naming the narrower one, rather than a registration it may not owe. That is a deliberate move from a confident wrong answer to an honest question. No shipped rule conditions on charitableAssetsMinorUnits after this change, which is a fact about the current pack rather than about the fact. WHAT WAS AND WAS NOT RE-READ ON 2026-09-09: WAC 434-120-305 only \u2014 the threshold, the word \u201cexceeding\u201d and the income-producing qualifier. The fee, the deadline and the cadence keep the verifications recorded above and were NOT re-checked. See docs/rule-verification/2026-09-09-wa-charity-exemption-facts.md. DEADLINE VERIFIED, WAC 434-120-025 VERBATIM: 'Renewal date for charitable organizations, commercial fund-raisers, and charitable trusts means the last business day of the eleventh month after the close of the organization's accounting year.' The same date as the solicitation renewal, which is why merging them looked harmless \u2014 the deadlines coincide and only the form and the fee differ. FEE VERIFIED, WAC 434-120-042: charitable trusts pay $25.00 initial and $25.00 annual renewal, against $60/$40 for a charitable organization. KNOWN WRONG, NOT FIXABLE IN THIS SCHEMA: the WAC says last BUSINESS day; dayOfMonth 'last' gives the last calendar day, so a month ending at a weekend shows a deadline up to 2 days LATE. weekendRule offers only roll-forward and this needs backward \u2014 see NEH-404. STILL DRAFT: every value here was read from a primary source, but promotion means a PERSON read it. See docs/rule-verification/. AGENCY URL NOT CLICKABLE FROM CI: sos.wa.gov returns 403 to every automated request \u2014 including its own root and a path that does not exist, so the status carries no information about whether a URL is real. This one is the agency's own published page (search engines have crawled it) but nobody here has opened it. A person must, once. See NEH-402. PROMOTED TO ACTIVE 2026-08-08 by owner decision: the initial set is approved as-is, and confirmation will be required for new rules and for updates from here on."
}
