{
  "$schema": "../../schema/rule.v1.json",
  "id": "us-wa-charitable-solicitation-registration",
  "jurisdiction": "US-WA",
  "title": "Charitable Organization Registration Renewal",
  "agency": "Washington Secretary of State, Charities Program",
  "entityTypes": [
    "501c3",
    "nonprofit-corp"
  ],
  "cadence": {
    "type": "annual",
    "anchor": "fiscal-year-end",
    "offsetMonths": 11,
    "dayOfMonth": "last"
  },
  "fee": {
    "amountMinorUnits": 4000,
    "currency": "USD"
  },
  "conditions": [
    {
      "fact": "solicitsCharitableContributions",
      "op": "eq",
      "value": true
    },
    {
      "anyOf": [
        {
          "fact": "contributionsRaisedMinorUnits",
          "op": "gte",
          "value": 5000000
        },
        {
          "fact": "allFundraisingUnpaid",
          "op": "eq",
          "value": false
        },
        {
          "fact": "assetsOrIncomeInureToInsiders",
          "op": "eq",
          "value": true
        }
      ]
    }
  ],
  "weekendRule": "roll-backward",
  "citation": "RCW 19.09.075; RCW 19.09.085; WAC 434-120-140(2)(a); WAC 434-120-042",
  "citationUrl": "https://app.leg.wa.gov/wac/default.aspx?cite=434-120-140",
  "agencyUrl": "https://www.sos.wa.gov/corporations-charities/charities",
  "lastVerified": "2026-09-09",
  "status": "active",
  "effectiveFrom": "2020-01-01",
  "notes": "NARROWED 2026-08-05 (NEH-401): this rule used to ALSO trigger on holding $250,000+ in charitable assets, which is a different registration entirely \u2014 RCW 11.110 charitable TRUST registration, now us-wa-charitable-trust-registration. The deadlines coincide (both are the last business day of the eleventh month after the accounting year, WAC 434-120-025), which is why merging them looked harmless; the forms and the fees do not. An endowed non-soliciting charity was being sent to the wrong form at $40 instead of $25. FEE VERIFIED TWICE, independently: RCW 19.09.062(2) and WAC 434-120-042 both give $40 for a charitable organization ANNUAL RENEWAL against $60 for an initial registration. This rule is the renewal. DEADLINE VERIFIED, WAC 434-120-140(2)(a) VERBATIM: 'The completed form and fee shall be received no later than the last business day of the eleventh month after the end of the organization's accounting year.' The statute does NOT set this \u2014 RCW 19.09.085(2) delegates it to the secretary by rule \u2014 so the WAC is the citation that matters. VOLUNTEER EXEMPTION NOW EXPRESSED, 2026-09-09, REPLACING THE \u201cKNOWN FALSE POSITIVE, NOT EXPRESSIBLE YET\u201d NOTE THAT STOOD HERE FROM 2026-08-05. That note said this rule needed two facts the model did not have and could not express the exemption; it needed THREE, and the schema turned out to be sufficient. RCW 19.09.081 READ VERBATIM FROM THE PRIMARY SOURCE: \u201cThe application requirements of RCW 19.09.075 do not apply to: (1) Any charitable organization raising less than fifty thousand dollars in any accounting year when all the activities of the organization, including all fund-raising activities, are carried on by persons who are unpaid for their services and no part of the charitable organization's assets or income inures to the benefit of or is paid to any officer, director, member, or trustee of the organization, other than as part of a charitable class benefited by the charitable organization.\u201d THREE LIMBS, CONJUNCTIVE, ALL THREE MODELLED. An exemption is a negated conjunction, so it is expressed as the disjunction of its failures: this rule applies when the organisation solicits AND (it raised $50,000 or more OR its activities are not all carried on by unpaid persons OR assets or income inure to an insider). NO SCHEMA CHANGE WAS NEEDED \u2014 one `anyOf` group is exactly that shape, and the evaluator's known-true-beats-unknown precedence means an organisation over the money line is never asked the other two questions. WHY THE INUREMENT LIMB IS MODELLED RATHER THAN NOTED AND DROPPED: dropping a limb of a conjunctive exemption makes the exemption THIS PACK IMPLEMENTS BROADER THAN THE STATUTE'S, exempting an organisation the statute does not \u2014 under-filing, the one direction this pack refuses. WHY contributionsRaisedMinorUnits AND NOT grossRevenueMinorUnits: \u201craising\u201d is money obtained by asking. Gross revenue also carries program-service revenue, investment income and contracts, so testing it against this line would deny the exemption to a theatre living on ticket sales and to an endowment-funded grantmaker, neither of which raised anything. \u201cRaising\u201d is NOT DEFINED in the statute; this pack reads it through RCW 19.09.020's definition of \u201csolicitation\u201d and counts an ambiguous receipt IN, which can only push an organisation toward registering. SCOPE OF THE EXEMPTION, because the section is written against a different rule number: RCW 19.09.081 exempts from the APPLICATION requirements of RCW 19.09.075, and this rule is the annual RENEWAL. An organisation that never had to register has nothing to renew, so the exemption gates this rule too. WHAT AN UNANSWERED ORGANISATION SEES: undecided, with the question attached \u2014 not told to register, and not told it is exempt. WHAT WAS AND WAS NOT RE-READ ON 2026-09-09: RCW 19.09.081 only. The fee, the deadline, the cadence and the weekend rule keep the verifications recorded above (2026-08-05 and 2026-08-08) and were NOT re-checked in this pass; `lastVerified` is bumped because the condition set changed on a source that was read, and this sentence is what stops that bump reading as a claim about the rest. See docs/rule-verification/2026-09-09-wa-charity-exemption-facts.md. KNOWN WRONG, NOT FIXABLE IN THIS SCHEMA: last BUSINESS day vs last calendar day \u2014 see NEH-404. AGENCY URL NOT CLICKABLE FROM CI: sos.wa.gov returns 403 to every automated request \u2014 including its own root and a path that does not exist, so the status carries no information about whether a URL is real. This one is the agency's own published page (search engines have crawled it) but nobody here has opened it. A person must, once. See NEH-402. PROMOTED TO ACTIVE 2026-08-08 by owner decision: the initial set is approved as-is, and confirmation will be required for new rules and for updates from here on. HOLIDAYS DELIBERATELY NOT APPLIED (NEH-443): this rule rolls BACKWARD to the last business day, and WAC 434-120-140(2)(a) means a business day \u2014 so a Friday that is a Washington state holiday is not one and this date can still be wrong. No `holidayCalendar` is named because state holidays are not modelled: Washington observes at least one day the federal calendar does not, and applying the federal set here would move some dates correctly and leave others wrong with nothing in the output to say which. Obligations from this rule therefore report NO holiday calendar, which is the honest signal that the date was not holiday-checked."
}
